{"$schema":"https://json-schema.org/draft/2020-12/schema","$id":"https://japanese-learning-os.local/schemas/srs-queue.schema.json","title":"Japanese Learning OS SRS queue","type":"object","required":["version","schedule_intervals_days","priority_rules","review_queue"],"properties":{"version":{"type":"string"},"schedule_intervals_days":{"type":"array","minItems":1,"items":{"type":"integer","minimum":1}},"priority_rules":{"type":"object","required":["mistake_priority_boost","weak_point_priority_boost","max_new_items_when_reviews_due"],"properties":{"mistake_priority_boost":{"type":"integer","minimum":0},"weak_point_priority_boost":{"type":"integer","minimum":0},"max_new_items_when_reviews_due":{"type":"integer","minimum":0}},"additionalProperties":false},"review_queue":{"type":"array","items":{"type":"object","required":["id","target","prompt","expected_pattern","priority","due"],"properties":{"id":{"$ref":"#/$defs/id"},"target":{"type":"string"},"prompt":{"type":"string"},"expected_pattern":{"type":"string"},"priority":{"type":"integer","minimum":0},"due":{"oneOf":[{"type":"string","format":"date"},{"const":"next_session"}]},"scheduling":{"type":"object","required":["interval_index","repetitions","lapses","last_quality","last_reviewed"],"properties":{"interval_index":{"type":"integer","minimum":0},"repetitions":{"type":"integer","minimum":0},"lapses":{"type":"integer","minimum":0},"last_quality":{"type":"integer","minimum":0,"maximum":5},"last_reviewed":{"type":"string","format":"date"}},"additionalProperties":false}},"additionalProperties":false}}},"additionalProperties":false,"$defs":{"id":{"type":"string","pattern":"^[a-z][a-z0-9]*_[0-9]{3}$"}}}
